title,timestamp,score,sentiment_score,smoothed_sentiment
What stocks are you looking at right now,2025-05-11 10:07:48,132,0.0,
How many positions is too many?,2025-05-11 10:42:15,40,0.0,
US and China hold 2nd day of tariff talks. No breakthroughs but Trump touts 'great progress',2025-05-11 10:49:06,495,0.8625,
The world is passing us by (infographic),2025-05-11 11:25:35,165,0.0,
"Trade war is about more than just trade, China’s official news agency argues",2025-05-11 12:59:45,533,-0.7579,
China and Trump Summary Up to Date,2025-05-11 15:21:17,345,0.0,
What does this mean for UNH,2025-05-11 20:09:18,207,0.0,
"China confirms trade talks were constructive, joint statement expected today",2025-05-11 22:04:48,668,0.0,-0.06184666666666667
Impact of US policy on stocks,2025-05-12 00:08:12,61,0.0,-0.09477333333333333
"BREAKING: US cutting levies on Chinese goods to 30% from 145%, China is lowering its levies on US goods to 10% from 125% - both for 90 days!",2025-05-12 03:26:02,3254,-0.4199,-0.09477333333333333
"People need to start taking Trump literally - When he says buy, you should buy",2025-05-12 05:53:07,977,0.0,-0.15227333333333334
New ATH for stock market in the very near future?,2025-05-12 07:18:59,104,0.0,-0.15227333333333334
Unexplored $GOOG Bull Case: Hedge against a post AGI world,2025-05-12 07:34:22,26,0.0,-0.10174666666666667
Trump’s Vow to Cut US Drug Prices Drags Pharma Stocks Lower,2025-05-12 08:29:58,419,-0.6124,-0.10174666666666667
"OpenAI negotiates with Microsoft for new funding and future IPO, FT reports",2025-05-12 09:44:40,16,0.0,-0.10174666666666667
This shit is confusing – Original Announced Tariffs are still basically in place and market goes up?,2025-05-12 09:57:56,1200,-0.4939,-0.10174666666666667
Tesla quietly gets back to $1 Trillion market cap,2025-05-12 10:19:02,1280,0.0,-0.10174666666666667
Apple considers raising iPhone prices,2025-05-12 10:52:39,162,0.0,-0.07375333333333334
Current Market has reminded me never to listen to reddit,2025-05-12 13:05:06,5262,0.0,-0.11371333333333335
The China tarrifs are not the only one,2025-05-12 13:50:39,440,0.0,-0.07860000000000002
My portfolio is finally green!,2025-05-12 16:16:20,35,0.0,-0.07860000000000002
Trump Administration Considers Large Chip Sale to Emirati A.I. Firm G42,2025-05-12 16:24:47,117,0.0,-0.018040000000000007
Let's talk about CPI/PPI,2025-05-12 16:51:16,58,0.0,-0.018040000000000007
Shout-Out to all the Dip Buyers,2025-05-12 16:59:14,1040,0.0,0.01488666666666666
Megacap tech adds more than $800 billion in market cap after U.S.-China tariff pause,2025-05-12 16:59:22,26,0.0,0.0015333333333333254
"Grandmas Death, Moms been receiving Dividend checks for 8 years and cant cash them.",2025-05-12 17:00:23,36,-0.5994,0.0015333333333333254
"Coinbase shares spike as crypto exchange set to join S&P 500, replacing Discover Financial",2025-05-12 17:36:42,236,0.5267,0.03760666666666666
When to add more stocks to a portfolio?,2025-05-12 19:19:59,22,0.0,0.07164666666666666
ASML - Massive Share Buybacks in 2025,2025-05-12 23:12:42,48,0.296,0.10100666666666666
"r/Stocks Daily Discussion & Technicals Tuesday - May 13, 2025",2025-05-13 05:30:31,22,0.0,0.09247333333333334
"UnitedHealth suspends annual forecast, CEO Andrew Witty steps down",2025-05-13 07:32:32,705,0.0,0.12305999999999999
CPI for all items rises 0.2% in April lowered than expected!,2025-05-13 08:35:38,548,-0.2003,0.11621333333333334
"CPI rose 2.3% for the 12 months ending April, Less than the expected 2.4%",2025-05-13 08:36:05,139,0.0,0.11621333333333334
(05/13) Interesting Stocks Today - United Healthcare CEO Resigns!,2025-05-13 09:08:51,12,0.5411,0.11147333333333333
"1 Year Later: Revisiting ""How much are you willing to pay for perfection?""",2025-05-13 09:16:13,21,0.5106,0.07636
Profit Taking,2025-05-13 09:40:44,32,0.4404,0.07636
Microsoft is cutting 3% of all workers,2025-05-13 10:29:06,3317,-0.128,0.05662666666666668
Vertiv Could Benefit from the HUMAIN & NVIDIA AI Factory Deal in Saudi Arabia,2025-05-13 11:18:10,20,0.4588,0.02494000000000001
"Over the past 10 years, annual CEO pay increases have averaged 8.7%, while total annual returns to shareholders have averaged 10.9%",2025-05-13 11:49:29,94,-0.1027,-0.025099999999999997
Robinhood grows its footprint in Canada by acquiring WonderFi,2025-05-13 12:02:18,20,0.0,-0.011746666666666662
"What if I'm wrong? Or, how to think about navigating uncertainty",2025-05-13 12:18:49,67,-0.6705,-0.011746666666666662
White House announces $600 billion Saudi investment in U.S.,2025-05-13 14:19:26,10007,0.0,-0.0719
Rethinking valuation based on fundamentals?,2025-05-13 15:04:26,32,0.0,-0.10594
SPMO (Invesco S&P 500 Momentum ETF) Hits New 52-Week High Today,2025-05-13 16:54:23,16,0.0,-0.10479333333333334
The SEC published a list once a day of all the stocks they found illegal naked short selling in. Then they just fine the banks 15 million!,2025-05-13 20:05:05,472,-0.4753,-0.10974666666666667
Did Billionaires Just Buy the Dip Again? Watching Post-Trade War Stock Rallies Feels Rigged,2025-05-13 22:52:56,1630,-0.7506,-0.14033333333333334
What is your most conservative way to earn in the stock market during bear and bull,2025-05-13 23:31:05,39,0.0,-0.16028
Fintech company Chime files for IPO,2025-05-13 23:53:04,23,0.0,-0.13631333333333334
How does us debt work?,2025-05-14 01:20:12,28,-0.3612,-0.07187999999999999
Low-value shipments from China are still subject to 54% tariffs,2025-05-14 02:32:16,109,0.0,-0.02864
It's very interesting seeing how the opinions change on this sub as an outsider.,2025-05-14 03:47:59,297,0.4576,-0.028640000000000006
What would need to happen to see April lows again?,2025-05-14 04:41:54,226,-0.2023,-0.028640000000000006
$60M Comeback: Former CEO Hemsley Returns to Lead UnitedHealth After Sudden Shake-Up,2025-05-14 09:01:22,45,0.0,-0.0003933333333333395
The eToro IPO- Boom or Doom?,2025-05-14 09:13:15,14,-0.4019,0.08680666666666666
(05/14) Interesting Stocks Today - Semis Strike Back!,2025-05-14 09:13:32,16,0.3595,0.08336666666666666
AMD announces $6 billion buyback; shares climb 8%,2025-05-14 09:42:11,470,0.296,0.11840666666666667
"Saudi Arabia plans to spend billions of dollars on AI chips, U.S. to revoke Biden's chip restrictions, NVIDIA shares extend gains",2025-05-14 10:01:36,87,0.6486,0.14248666666666668
Court hearings on tariffs the reason the market has bounced back?,2025-05-14 10:58:39,222,0.0,0.10737333333333335
$UNH is way oversold,2025-05-14 11:54:55,158,0.0,0.07686666666666667
Google needs 'big bang breakup' that would value its businesses at $3.7 trillion as AI threatens Search,2025-05-14 12:41:42,480,-0.0516,0.036886666666666665
Tesla Institutional Investor Movement- Mixed Bag- Mostly Positive,2025-05-14 13:15:37,18,0.5574,0.03688666666666666
The emotional chaos of selling a stock that’s ripping - Advice on taking profits,2025-05-14 14:46:36,80,-0.0516,0.09258666666666665
So nvidia is now 3.3T and the most valuable company on the market?,2025-05-14 16:18:40,419,0.5256,0.06862
"Why would anybody buy 0,5% 10 year T-bonds in 2022 when inflation was 8% over TIPS",2025-05-14 17:42:53,49,0.0,0.05742
UnitedHealthcare Under Criminal Investigation,2025-05-14 19:07:06,1494,-0.5267,0.01418
"In my opinion, 06/19, CyberCab is released, and the world will know that Tesla is the second Enron",2025-05-14 20:52:44,156,0.0,0.05230666666666666
"Regarding the UNH criminal probe, look at the WellCare fraud for clues of the Armageddon scenario.",2025-05-14 22:35:11,91,-0.802,0.05230666666666666
Boeing's record-breaking deal: Qatar Airways to buy up to 210 planes,2025-05-14 23:25:40,516,0.0,0.05574666666666666
CoreWeave reports more than 400% growth in its first earnings,2025-05-14 23:29:58,32,0.4336,0.010053333333333329
Goldman Sach not reporting trades,2025-05-15 02:01:26,70,0.0,-0.011960000000000002
Purely rational: Tesla robotaxi without L4 isn’t even a Challenger — Magic Quadrant shows how far it is from Waymo’s leadership,2025-05-15 02:30:28,44,0.128,-0.016506666666666666
"r/Stocks Daily Discussion & Options Trading Thursday - May 15, 2025",2025-05-15 05:30:33,19,0.0,-0.05816666666666667
Who wins the robotaxi race - WAYMO or Tesla?,2025-05-15 06:29:06,137,0.5719,-0.02305333333333334
"Walmart CFO says price hikes from tariffs could start later this month, as retailer beats on earnings",2025-05-15 07:55:49,277,0.0,0.019406666666666662
Dick’s Sporting Goods to buy Foot Locker for $2.4 billion,2025-05-15 07:59:54,126,0.0,0.07287333333333333
"PPI for final demand decreases 0.5% in April; services decline 0.7%, goods unchanged",2025-05-15 08:35:18,245,-0.128,0.07287333333333333
"No way Musk gets $50B. In my Aussie MBA, the US’s 300:1 pay ratio is taught as the most extreme example of inequality and company governance",2025-05-15 08:37:04,564,-0.3818,0.07075999999999999
(05/15) Interesting Stocks Today - DOJ investigating UNH!,2025-05-15 09:03:14,17,0.4574,0.07075999999999999
Coinbase says hackers bribed staff to steal customer data and are demanding $20 million ransom,2025-05-15 09:04:26,479,-0.6249,0.062226666666666666
BREAKING: Walmart to hike prices imminently,2025-05-15 09:13:15,9534,0.0,0.062226666666666666
Your best dividend stocks 2025?,2025-05-15 10:33:18,90,0.6369,0.0241
US GDP projections since dec 2024,2025-05-15 12:24:20,12,0.0,0.0241
"Michael Burry has sold every stock in his portfolio except for a new position in Estee Lauder, $EL.",2025-05-15 16:58:34,768,0.0,0.0241
Google hits 150 million users for subscription service with help of AI,2025-05-15 18:24:49,284,0.4019,0.06322
High yield savings accounts?,2025-05-15 21:30:46,28,0.0,0.08523333333333333
Currently deciding what to do with my cash: HYSA vs SGOV?,2025-05-16 00:16:19,11,0.0,0.02794666666666667
"r/Stocks Daily Discussion & Fundamentals Friday May 16, 2025",2025-05-16 05:30:31,13,0.0,0.06960666666666666
Puma & Cristiano Ronaldo World Cup 2026,2025-05-16 06:38:47,14,0.0,0.07132666666666668
Donald Trump says US will set new tariff rates for scores of countries,2025-05-16 07:25:18,5062,0.0,0.05432
Barron's: Novo Nordisk Says CEO to Step Down,2025-05-16 07:31:55,138,0.0,0.02622
How cooked is New Fortress Energy Inc (NFE)? The top 10 biggest shareholders have lost 77-90% in value so far (Including BlackRock and VanG),2025-05-16 07:48:47,13,0.4588,0.02622
(05/16) Interesting Stocks Today - Medical Madness and Mergers,2025-05-16 09:14:41,17,-0.0516,0.02064
Applied digital (APLD) is up 23% today and almost doubled since the crash last month (99%),2025-05-16 14:49:02,29,-0.4019,0.05468
what's your market view from now on?,2025-05-16 15:20:53,74,0.0,0.07190666666666666
"Nvidia, Cisco and OpenAI are backing the UAE Stargate data center project",2025-05-16 15:27:57,27,0.0258,0.07190666666666666
US credit rating has been downgraded,2025-05-16 17:10:58,15157,0.3818,0.07190666666666666
UNH insiders (directors and executives) buy over $30m of the beaten down stock,2025-05-16 19:08:34,376,-0.4215,0.07875333333333333
HEDGE Funds may be on to something.,2025-05-16 19:42:21,1135,0.0,0.07875333333333333
Tesla limits investors' ability to sue over breach of fiduciary duties,2025-05-16 21:38:19,332,0.3182,0.04988666666666667
Bargain Bulls - Thank Me Later,2025-05-16 22:28:46,34,0.5106,0.05332666666666667
There’s no denying it now: Tariffs are raising prices,2025-05-17 00:40:41,1309,0.2584,0.08012
"/r/Stocks Weekend Discussion Saturday - May 17, 2025",2025-05-17 05:30:37,19,0.0,0.10691333333333333
Investing in the reconstruction of Ukraine?,2025-05-17 10:32:26,49,0.0,0.10519333333333332
"How can the middle class be dying, consumer debt all time highs, median salary has less purchasing power than ever, etc., yet record profits",2025-05-17 11:06:46,612,0.1027,0.07973999999999999
Trump tells Walmart to 'eat the tariffs' instead of raising prices,2025-05-17 11:39:13,8573,0.0,0.10783999999999999
Please stop using ChatGPT to do your investment research.,2025-05-17 13:44:43,324,0.0258,0.10783999999999999
Google: AI overview search results earns the same ad revenue as those without,2025-05-17 15:23:16,102,0.0,0.09347333333333332
What upcoming data/reports/events to watch out for that could impact the market?,2025-05-17 17:37:42,30,0.0,0.05943333333333333
Late to the Party? Square Enix and Hasbro,2025-05-17 19:42:43,17,0.4019,0.042460000000000005
Are we cooked?,2025-05-17 20:10:42,12334,0.0,0.06654
Did Parsons (PSN) really land $97bn contracts in Qatar??,2025-05-17 21:47:56,43,0.0,0.020486666666666674
Lets do a list of things impacting US economy,2025-05-18 04:37:03,79,0.0,0.039093333333333334
Forbes: Tesla Robotaxi Will Have ‘Lots Of Tele-Ops’—Which Means Supervised FSD,2025-05-18 09:42:37,250,0.0,-0.0028733333333333276
Any undervalued US defence stocks?,2025-05-18 09:48:45,24,0.1027,0.00889333333333334
What would you do with $150k right now advice needed,2025-05-18 11:04:40,485,0.0,0.00889333333333334
Alphabet would be more valuable broken up,2025-05-18 11:26:21,382,0.0038,0.03434666666666667
China hits many countries with tariffs- testing waters with Trump like policy,2025-05-18 12:13:33,1938,0.3612,0.014400000000000005
UNH Rallies Hard - Dead Cat or Real Reversal?,2025-05-18 15:50:01,57,-0.6908,0.014400000000000005
"S&P 500 Growth Since 1950 vs. Inflation, Wages, and GDP",2025-05-18 17:37:51,36,0.3818,0.05686000000000001
Bessent Warns Reciprocal Tariffs Will Return Without 'Good Faith' Talks,2025-05-18 18:02:46,310,-0.6295,0.05686000000000001
"The bond market doesn’t matter—as long as stocks go up, everything’s fine",2025-05-18 18:55:00,396,0.2023,0.038646666666666676
What a UAE Deal Might Mean For SMCI,2025-05-18 22:12:42,14,0.0,-0.005359999999999994
Downgrade of U.S. credit rating adds new complication to U.S. stock market,2025-05-19 00:42:04,650,0.3818,-0.005359999999999993
"Now that the future has arrived, Musk’s promises are collapsing one by one. Robotaxi,Cybercab and Car sales plummet",2025-05-19 00:48:20,1264,0.1027,-0.02382666666666666
30-Year Yield to 5% in early Asia trading,2025-05-19 01:20:47,334,0.0,-0.014979999999999993
Best Gold Mining Stocks To Invest In?,2025-05-19 03:28:52,23,0.6369,-0.002413333333333327
"r/Stocks Daily Discussion Monday - May 19, 2025",2025-05-19 05:30:31,21,0.0,-0.027866666666666658
Morgan Stanley says Buy US Stock Dips After Moody’s Cut,2025-05-19 08:24:25,294,-0.2732,-0.03054666666666666
Regeneron to buy bankrupt DNA testing firm 23andMe for $256 million,2025-05-19 08:55:57,223,-0.5574,-0.008919999999999994
Thinking about trying out some individual stocks versus index funds. Posted this to r/personalfinance but didn’t get much feedback,2025-05-19 09:45:14,11,0.0,-0.008919999999999996
How do you guys feel about low net income,2025-05-19 10:03:38,11,-0.2732,-0.03437333333333333
Nordstrom shareholders approve merger agreement with Norse,2025-05-19 11:11:39,18,0.4939,-0.04121999999999999
Trump’s $4 Trillion Tax Plan Clears Key Committee But the Fight Is Just Beginning,2025-05-19 11:16:33,1332,-0.5023,-0.04121999999999999
UnitedHealth Group (UNH) Analysis,2025-05-19 14:12:14,35,0.0,-0.04095999999999999
"NVDA expects $15B loss in revenue due to ""deeply painful"" H20 Bans",2025-05-19 16:05:29,583,-0.6697,-0.07274
CoreWeave - yay or nay?,2025-05-19 16:27:40,24,0.5267,-0.054526666666666654
The last few weeks have been baffling.,2025-05-19 20:09:10,886,0.0,-0.017366666666666655
Is this why markets have been not making sense?,2025-05-19 20:54:43,185,0.0,-0.060606666666666656
What was the reason for these giant Spikes down in the stock market?,2025-05-19 21:15:24,64,0.0,-0.04239333333333332
"Subaru of America increases vehicle prices, citing market conditions",2025-05-19 21:30:16,445,0.0,-0.07359999999999998
Waymo gets OK to expand robotaxi service into more of Silicon Valley,2025-05-19 21:49:39,298,0.6408,-0.04011333333333332
Stocks seem overpriced. Am I wrong?,2025-05-19 22:44:19,187,-0.4767,-0.04011333333333332
"Retail Traders Go on Record Dip Buying Spree monday..... Was this you, reddit??",2025-05-19 23:23:24,353,0.0,0.004533333333333342
"r/Stocks Daily Discussion & Technicals Tuesday - May 20, 2025",2025-05-20 05:30:31,17,0.0,-0.07304
"Smartphone exports from China to US plunge 72% in April, hitting lowest level since 2011 amid tariff tensions",2025-05-20 06:51:20,461,-0.6486,-0.046246666666666665
CATL goes public in Hong Kong Listing - climbs 16% in debut,2025-05-20 06:51:58,72,0.0,-0.046246666666666665
Elon Musk commits to leading Tesla for next five years,2025-05-20 09:58:07,2104,0.0258,-0.046246666666666665
Capital one Deliquency,2025-05-20 10:13:41,21,0.0,-0.046246666666666665
"Stock Buying Platform Recommendation : Robinhood, Charles Schwab, etc",2025-05-20 13:09:05,14,0.0,-0.08896666666666667
"gold silver PGM all going up, what is happening today?",2025-05-20 13:28:23,63,0.0,-0.049593333333333336
"Buy now, pay never? Some Klarna users struggle to repay loans as U.S. consumer debt rises",2025-05-20 15:59:37,313,-0.6369,-0.049593333333333336
Warby Parker pops 16% on $150 million Google smart glasses partnership,2025-05-20 17:40:46,367,0.4019,-0.049593333333333336
"Elon Musk says Tesla, xAI expect to keep buying chips from Nvidia and AMD",2025-05-20 17:43:44,41,0.0,-0.03694
The 15 biggest announcements at Google I/O 2025,2025-05-20 17:44:41,182,0.0,-0.008839999999999999
Google launches $250 per month ‘VIP’ AI subscription service,2025-05-20 17:45:39,574,0.0,-0.024046666666666668
Toyota redesigns America’s top-selling RAV4 SUV to exclusively be a hybrid,2025-05-20 21:25:27,225,0.0,-0.001379999999999996
Which industries do you think are least affected by tariffs?,2025-05-20 22:58:31,48,0.1139,-0.021113333333333328
Palo Alto Networks beats on earnings and revenue,2025-05-21 00:15:44,29,0.0,-0.021113333333333328
"r/Stocks Daily Discussion Wednesday - May 21, 2025",2025-05-21 05:30:42,14,0.0,0.06130666666666668
Target takes an earnings beating,2025-05-21 07:23:34,6944,-0.4588,0.027666666666666676
United Healthcare secretly paid off nursing homes,2025-05-21 07:55:10,894,0.4215,0.04115333333333335
Morgan Stanley turns bullish on U.S. stocks. Here’s why it says the market lows have already been made.,2025-05-21 08:47:04,113,-0.2023,0.07293333333333334
"Hedge funds are shorting stocks again, boosting leverage to new record",2025-05-21 09:08:53,146,0.34,0.06778666666666668
NYC hardos and international students can’t stop. Canada Goose SMASHES earnings.,2025-05-21 09:58:08,168,-0.296,0.06778666666666668
Why is my 4x leveraged NVDA ETF still down even though NVDA recovered?,2025-05-21 12:13:10,133,0.0,0.06019333333333334
"Fair Issac $FICO down 25% in two days over FHFA director comments to make provider of credit scores to be more ""economical""",2025-05-21 12:25:35,27,0.5994,0.06019333333333334
UnitedHealth urges shareholders to back CEO’s $60M pay package,2025-05-21 12:25:59,1392,-0.1027,0.06019333333333334
Dow tumbles more than 600 points as Treasury yields continue to push higher,2025-05-21 14:06:52,1417,0.2023,0.11344666666666668
"US to keep China chip curbs, spurning Nvidia’s call for relief",2025-05-21 15:11:49,168,0.4767,0.08534666666666668
CoreWeave shares soar 19% after $2 billion debt offering,2025-05-21 16:24:50,79,-0.0772,0.14836666666666667
"ETOR valuation against HOOD, IBKR & BULL",2025-05-21 16:46:40,17,0.0,0.1257
Wolfe Research Sees Margin Recovery As Key Catalyst for Unitedhealth (UNH),2025-05-21 17:16:21,16,0.0,0.14543333333333336
Teen with 120 dollar portfolio,2025-05-21 17:25:38,113,0.0,0.11607333333333335
Why do reporters only mention actual stock price change and not percent change?,2025-05-21 17:31:48,256,0.0,0.09278000000000002
"Trump says he’s giving “serious consideration” to releasing Fannie Mae, Freddie Mac",2025-05-21 21:11:30,1832,0.34,0.09962666666666668
"r/Stocks Daily Discussion & Options Trading Thursday - May 22, 2025",2025-05-22 05:30:32,15,0.0,0.08614000000000001
Solar stocks tanking as GOP ends clean energy credits in House Bill,2025-05-22 08:48:44,1289,0.743,0.05436
"Kraken Crypto Exchange to Launch Digital Tokens of Over 50 ETFs and Stocks Such as Apple, Nvidia and Tesla",2025-05-22 10:03:51,34,0.0,0.014806666666666671
Google faces antitrust investigation over deal for AI-fueled chatbots,2025-05-22 12:17:19,72,0.0,0.029893333333333334
Ryan Reynolds’ MNTN Shares Rise 48% After $187 Million IPO,2025-05-22 16:10:31,513,-0.4404,0.046560000000000004
"IonQ Jumps 40% on Earnings Beat, Quantum Logistics Deal With Einride, and CEO's 'Nvidia of Quantum' Vision",2025-05-22 16:49:58,66,0.25,0.06922666666666667
Why Hims & Hers Health (HIMS) Stock Is Down Today,2025-05-22 17:47:17,33,0.0,0.06922666666666667
NFLX adding generative AI adds to streams and during pauses.,2025-05-22 19:04:30,85,0.0,0.0033200000000000044
"r/Stocks Daily Discussion & Fundamentals Friday May 23, 2025",2025-05-23 05:30:39,14,0.0,0.0033200000000000083
"The Doha interview confirmed that car sales are still Tesla's anchor, and Musk is trying hard to blur this anchor.The crisis is coming quiet",2025-05-23 05:34:45,335,-0.6705,-0.0037533333333333195
Trump recommends 50% tariff on European Union starting June 1,2025-05-23 08:04:01,3621,0.2263,0.02917333333333334
"Tesla: Vision, Volatility, and the Illusion of Invincibility",2025-05-23 09:14:56,31,0.25,0.02917333333333334
The Only U.S. Uranium Enrichment Play,2025-05-23 11:41:50,132,0.34,0.05853333333333334
Oracle to buy $40bn of Nvidia chips for OpenAI’s new US data centre,2025-05-23 14:15:46,332,0.0,0.006753333333333345
"Dow Jones, S&P 500 and Nasdaq trim losses as Trump threatens new tariffs on Apple and EU",2025-05-23 15:44:52,123,-0.6486,0.02342000000000001
Could Retail go from Rally Fuel to Anchor?,2025-05-23 16:11:12,24,0.0,0.02342000000000001
What are the best robotics stocks?,2025-05-23 17:09:14,102,0.6369,0.02342000000000001
US-EU trade agreement,2025-05-23 18:50:39,478,0.4939,0.04266666666666669
Invest in Cults Theory,2025-05-24 07:40:48,63,0.0,0.02758000000000001
"Nvidia to launch cheaper Blackwell AI chip for China after US export curbs, sources say",2025-05-24 11:17:13,126,0.0,0.024400000000000015
Trump says he’s ‘not looking for a deal’ with the EU after threatening a 50% tariff,2025-05-24 11:30:18,1519,-0.5267,0.001733333333333344
Some Nuke plays part 2,2025-05-24 16:24:10,27,0.25,0.001733333333333344
Is RDDT a buy at this price?,2025-05-24 17:31:58,286,0.0,0.07433333333333335
Teradyne (TER),2025-05-24 18:48:37,19,0.0,0.07433333333333335
Nvda (Nvidia) upcoming earnings will either pump or dump the market,2025-05-24 20:36:42,104,-0.3818,0.03187333333333334
"Found ""Investors Stock Fund Inc"" Capital Stock Certificate From 1956",2025-05-24 20:50:23,166,0.0,0.041406666666666675
"Because of China's 618 National Shopping Festival, coupled with government subsidies, Apple products are 30% off, crazy sales",2025-05-25 07:09:09,156,0.2023,0.059620000000000006
"What To Expect in the Markets This Week: May 27–30, 2025",2025-05-25 09:16:24,68,0.0,0.059620000000000006
"Nvidia earnings Trump tariff updates, and the Fed's preferred inflation gauge: What to know this week",2025-05-25 10:56:51,90,0.0,0.09473333333333334
TSLA vs. BYDDY – Which EV Stock Is the Better Bet Right Now?,2025-05-25 16:53:00,68,0.4404,0.07806666666666667
FNMA or FMCC - is there even a difference?,2025-05-25 18:42:07,15,0.0,0.10073333333333334
Trump delays 50% tariffs on EU to July 9,2025-05-25 18:46:55,2614,0.0,0.08724666666666667
Which BYD is the best option for a UK investor?,2025-05-26 00:56:21,16,0.6369,0.09921333333333333
Fed official sends strong message about interest-rate cuts,2025-05-26 02:10:40,258,0.2732,0.09921333333333333
"r/Stocks Daily Discussion Monday - May 26, 2025",2025-05-26 05:30:31,13,0.0,0.09426
EU sees 'new impetus' in trade talks from weekend call with Trump.,2025-05-26 07:33:55,104,0.0,0.09426
"Nippon Steel and US steel officially enter a ""partnership"" as of today.",2025-05-26 09:43:02,111,0.0,0.09426
"Title: Trump Delays Tariffs on the EU, Boosting Global Markets",2025-05-26 10:21:34,163,0.34,0.0649
"Volvo Cars to cut 3,000 jobs globally amid cost-cutting efforts and industry challenges",2025-05-26 10:58:07,114,-0.2023,0.0649
Chinese EV Stocks Tumble After BYD Slashes Prices as Much as 34%,2025-05-26 16:32:18,1411,-0.2023,0.0649
What's your process for researching a new stock you might invest in?,2025-05-26 16:58:09,53,0.0,0.02244
EU trade negotiator says he’s had ‘good calls’ with U.S. after Trump extends tariff deadline,2025-05-26 18:29:49,196,0.128,0.004226666666666668
Which not-so-well-known brands are slowly emerging in the daily person's life?,2025-05-26 22:31:23,500,0.0,0.004226666666666668
BYD outsells Tesla in Europe for the first time as registrations surge in April,2025-05-27 01:57:03,1039,0.0,0.004226666666666668
"r/Stocks Daily Discussion & Technicals Tuesday - May 27, 2025",2025-05-27 05:30:31,12,0.0,-0.013986666666666666
Fico stock craters again today,2025-05-27 10:39:45,68,0.0,-0.0037266666666666707
NVIDIA Earnings Tomorrow – The Market’s Locomotive Report. Thoughts?,2025-05-27 11:16:14,48,0.0,0.00976
Why are markets pumping so much today after renouncing tariffs?,2025-05-27 12:34:30,2483,0.0,0.02324666666666667
US economic anecdotes,2025-05-27 15:29:02,75,0.0,0.051346666666666665
Pros and Cons of Investing in Circle Internet Financial’s Upcoming IPO (CRCL) – Thoughts?,2025-05-27 15:39:23,23,0.0,0.042813333333333335
Disability Investments,2025-05-27 15:40:09,11,0.0,0.06402666666666666
The Magnificent 7 drove a $36 billion loss for short sellers as stocks soared after tariff chaos,2025-05-27 16:55:43,704,-0.2732,0.10398666666666667
US Poised to Receive Golden Share in US Steel-Nippon Tie-Up,2025-05-27 17:53:57,336,0.4939,0.10398666666666667
Cramer tonight?,2025-05-27 19:05:37,229,0.0,0.10398666666666667
"Trump says US to retain oversight, guarantees in Fannie Mae, Freddie Mac spinoff",2025-05-27 19:16:22,426,0.0,0.10398666666666667
