title,timestamp,score,sentiment_score,smoothed_sentiment
Nvidia's Long-Term Prospects Remain Terrific - I'm going to ignore Q1-earnings noise.,2025-05-27 22:00:19,24,0.4215,0.08277333333333334
"r/Stocks Daily Discussion Wednesday - May 28, 2025",2025-05-28 05:30:34,20,0.0,0.08277333333333334
"GE Aerospace CEO sees supply chain improvements, despite tariff hit",2025-05-28 09:26:15,32,0.3182,0.08449333333333334
Elon Musk just dunked on Trump’s $3T “Big Beautiful Bill”  and now tech bros are turning,2025-05-28 11:46:30,19696,0.5994,0.06940666666666667
Policy Catalyst: How Big Could the Trump Nuclear Executive Order Be?,2025-05-28 12:18:58,51,0.0,0.08762000000000002
Did Trump break the stock market?,2025-05-28 12:34:01,1583,0.0,0.029240000000000006
BREAKING: Antonio Filosa Named New Stellantis CEO,2025-05-28 13:38:34,164,0.0,-0.007919999999999993
The market is greedy without any grounds. Thin ice?,2025-05-28 14:03:13,32,-0.3182,-0.016453333333333327
Chip software stocks sink on report Trump ordered halt to China sales,2025-05-28 15:39:02,237,0.0,-0.04455333333333333
Trump Bristles at ‘TACO Trade’ That Bets on Him Backing Down,2025-05-28 15:46:20,1496,0.0258,-0.024819999999999995
"HP sinks 15% as company misses on earnings, guidance due to ‘added cost’ from tariffs",2025-05-28 16:21:36,126,-0.2263,-0.023366666666666657
NVDA earnings,2025-05-28 16:24:35,296,0.0,-0.017326666666666667
I think the Court of International Trade just overturned the emergency tariffs,2025-05-28 19:15:53,1572,-0.3818,0.0018000000000000054
Stock futures jump after U.S. Trade Court Rules Trump’s ‘Liberation Day’ Tariffs Are Illegal,2025-05-28 19:31:17,2680,-0.5574,0.0018000000000000054
Tesla investors demand Musk work 40-hour week at EV maker as ‘crisis’ builds,2025-05-28 19:57:38,342,-0.128,0.0018000000000000054
Chinese Trader Who Made $1.5 Billion on Gold Builds a Giant Bet on Copper,2025-05-28 19:58:26,228,0.0,0.023013333333333337
"Rddt (reddit) is a major buy now, don't wait, reddit set to join russell 3000 on june 27th",2025-05-28 20:57:23,471,0.296,-0.014146666666666663
"Trump's Tariffs are not over yet, he still has cards to play",2025-05-28 22:14:22,512,0.34,-0.01586666666666666
Jim Cramer says he's not an AI doomer. Looks like our jobs are safe!,2025-05-29 00:29:16,39,0.69,-0.010153333333333328
Are you beating the market this year? If so what’s your biggest winner?,2025-05-29 02:13:13,162,0.2869,-0.010153333333333328
"r/Stocks Daily Discussion & Options Trading Thursday - May 29, 2025",2025-05-29 05:30:34,14,0.0,0.015300000000000003
NY Times: Export Controls Are Endangering the Fragile U.S.-China Truce,2025-05-29 07:48:29,77,0.0,0.05246
To sell or hold avgo?,2025-05-29 09:36:44,13,0.0,0.10768000000000001
"Dow Jones, S&P 500 and Nasdaq rise as Wall Street weighs Trump tariff ban and NVIDIA earnings",2025-05-29 09:54:26,41,-0.5574,0.10768000000000001
Second federal court rules against Trump’s tariffs,2025-05-29 13:46:29,1167,0.0,0.06973333333333334
Trump Tariffs Blocked... But He Might Be Back Fast  Should We Be Pricing This In?,2025-05-29 14:13:53,141,-0.1406,0.09312000000000001
Trump tariffs reinstated by appeals court for now,2025-05-29 15:20:52,3662,0.0,0.04712000000000001
"Dell Technologies' overall net revenue for the first quarter of fiscal 2026 was $23.38 billion, compared to analysts' expectations of $23.15",2025-05-29 16:11:56,34,0.0,0.06203333333333334
When do you decide to sell a stock?,2025-05-29 16:23:55,118,0.0,0.06203333333333335
UIPath (PATH) Shows solid growth in the quarter - Agentic AI growth is accellerating,2025-05-29 18:18:03,16,0.7003,0.06203333333333335
What to look for when investing in small or mid caps?,2025-05-29 18:52:43,17,0.0,0.03393333333333335
"Is it justifiable for Lucid stock to drop 8.37% today because ""Unconfigurable"" Lucid Air?",2025-05-29 19:37:53,47,-0.2732,0.05136000000000001
Bessent says US trading partners still negotiating in good faith after court ruling,2025-05-29 20:52:15,133,0.6908,0.05480000000000002
Air Canada Tender offer,2025-05-29 20:52:42,54,0.0,0.06417333333333336
Costco tops earnings and revenue estimates,2025-05-29 23:59:07,96,0.5106,0.07603333333333336
"Section 899 of the ""Big beatiful bill"", implications for non US based investors and the stockmarket",2025-05-30 00:54:35,549,0.0,0.07603333333333336
"r/Stocks Daily Discussion & Fundamentals Friday May 30, 2025",2025-05-30 05:30:31,14,0.0,0.07603333333333336
New pump and dump: Stock futures fall as Trump says China has violated trade agreement,2025-05-30 08:29:05,1213,-0.4215,0.008133333333333348
"April Inflation Milder Than Expected at 2.1% vs expected 2.2% PCE.  Core CPE was 2.5% in April, lower than projections of 2.6%.",2025-05-30 08:41:53,117,-0.296,0.030800000000000015
Tesla stock poised for another weekly gain as Musk prepares to make full return to company amid alleged drug abuse,2025-05-30 11:25:40,465,0.0516,0.04901333333333335
Trump Taps Palantir to Compile Data on Americans,2025-05-30 12:00:46,5048,0.0,0.02984666666666668
S&P 500 drops 1% as US eyes tougher China tech sanctions targeting subsidiaries of blacklisted firms,2025-05-30 13:05:34,310,0.1779,0.02984666666666668
"Wait, what? $DUOL pricing",2025-05-30 13:57:32,115,0.0,-0.03597333333333332
What to do with Alibaba?,2025-05-30 15:12:12,24,0.0,-0.009179999999999992
China trade deal was a core reason for the market rebound. Why are freshly announced sanctions/deteriorating trade relations being ignored?,2025-05-30 15:49:32,265,-0.3182,-0.009179999999999992
Anyone else looking at Vertiv (VRT) as a long-term AI infrastructure play?,2025-05-30 17:02:42,20,0.34,0.07274666666666668
Trump tells US steelworkers he’s going to double tariffs on foreign steel from 25% to 50%,2025-05-30 18:22:40,1753,0.0,0.08563333333333335
Proposed U.S. foreign tax bill would make US assets a lot less desirable worldwide.,2025-05-30 18:48:48,561,0.4033,0.08219333333333334
"Given the prices of Chinese EVs, what is the future of European and American automakers?",2025-05-30 20:01:27,125,0.0,0.12385333333333334
"Stop whining about the market ""not being rational"".",2025-05-30 22:49:47,568,-0.4767,0.15445333333333336
"Tesla: The Enron-Lehman Hybrid of Our Time — When AI Dreams, Meme Stocks, and Narrative Capitalism Finally Hit the Wall",2025-05-31 05:18:48,200,0.4019,0.13037333333333334
"/r/Stocks Weekend Discussion Saturday - May 31, 2025",2025-05-31 05:30:41,11,0.0,0.13037333333333334
S&P 500 marks best May in 30 years as Wall Street bets on tariff relief,2025-05-31 07:54:16,93,0.8074,0.1728
EU Warns of Retaliation as Trump Doubles Steel Tariffs to 50%,2025-05-31 08:28:04,1696,-0.1027,0.1501333333333333
The case for $AMD.,2025-05-31 09:32:03,379,0.0,0.16362
"UNH Comeback? Hemsley Returns, Optum Moat Intact  A Value Stock Worth Watching",2025-05-31 12:48:27,17,0.6249,0.09068000000000001
"Costco, Best Buy, Nike, Walmart, Target and Macy’s among the retailers raising prices as Trump tariffs take hold",2025-05-31 14:54:23,3880,0.6369,0.09068000000000001
I don't think the the market will be able to ignore everything that the US is doing for much longer,2025-05-31 18:07:03,345,-0.3612,0.12246
Why you should question IONQ!,2025-05-31 19:37:43,161,0.0,0.09566666666666666
Cracks in the Bond market - Curious to know all your thoughts on the comments by JPM CEO.,2025-05-31 22:00:22,196,0.3182,0.09566666666666666
How do ETFs work?,2025-05-31 22:45:09,14,0.0,0.04184
Your top 5 picks and why?,2025-05-31 23:37:04,79,0.2023,0.04868666666666667
Hims to cut 4% of workforce amid ban on weight-loss drug copies,2025-06-01 02:48:30,74,-0.6908,0.09599333333333335
Rate My Portfolio - r/Stocks Quarterly Thread June 2025,2025-06-01 05:00:19,13,0.0,0.05519333333333334
JUNE GONNA BE SPICY   JOBS NUMBERS + TRUMP TARIFF ROULETTE,2025-06-01 08:18:42,1399,0.0,0.012733333333333336
"What to Expect in the Markets This Week: June 2–6, 2025",2025-06-01 09:22:39,57,0.0,0.03681333333333334
ACHR just logged a 6-minute piloted flight with N703AX – more than just simulations now,2025-06-01 11:00:51,24,0.0,-0.010493333333333332
How to sell a long term stock?,2025-06-01 11:45:21,83,0.0,-0.07839333333333333
My Thesis on  UnitedHealth UNH ($302) Oversold Bounce Setup,2025-06-01 14:23:31,42,0.0,-0.09812666666666667
E.l.f. Beauty remains committed to manufacturing in China despite tariffs,2025-06-01 14:28:29,151,0.7096,-0.06915333333333333
Trump is backing Nippon’s $14B takeover of US Steel   but with a twist: a so-called “golden share” that gives the U.S. government veto power,2025-06-01 17:12:21,807,0.0129,-0.023100000000000002
Hensoldt AG recent pump,2025-06-02 05:04:55,17,0.0,-0.04855333333333333
"r/Stocks Daily Discussion Monday - Jun 02, 2025",2025-06-02 05:30:32,17,0.0,-0.04170666666666667
"China Accuses US of Violating Trade Deal, Vows Firm Response",2025-06-02 06:25:28,1899,-0.7096,-0.05992
Bristol-Myers to Pay BioNTech Up to $11.1 Billion in Cancer Deal,2025-06-02 06:48:23,62,-0.7003,-0.030559999999999997
"S&P 500 to correct to ~5,250 no later than Q3, Stifel’s Bannister predicts",2025-06-02 09:49:35,186,-0.296,0.011900000000000003
Best API for fundamental data,2025-06-02 10:30:37,16,0.6369,0.011900000000000003
"Applied Digital Announces 250MW AI Data Center Lease With CoreWeave in North Dakota (APLD 40,48% up right now)",2025-06-02 10:49:00,45,0.0,-0.03540666666666666
Manufacturing activity contracted in May as imports hit lowest level since 2009,2025-06-02 12:47:23,274,-0.3818,-0.02277999999999999
UK Strategic Defence Review 2025,2025-06-02 14:00:20,23,0.1027,-0.05455999999999999
"Alphabet stock could drop up to 25% if judge forces Google to sell Chrome, Barclays says",2025-06-02 14:15:39,943,-0.2732,-0.05455999999999999
Ia now a good time to buy Coke consolidated? $COKE,2025-06-02 14:40:10,79,0.4404,0.024526666666666676
"Potus wants each country's ""best offer"" by Wednesday for a trade deal.",2025-06-02 15:12:34,3703,0.6369,0.12392
"What, exactly, is the stock market based on now",2025-06-02 16:24:14,881,0.0,0.14365333333333336
Update on tariff impact on LA/LB Ports,2025-06-02 20:46:29,59,0.0,0.10119333333333333
Dollar’s correlation with Treasury yields breaks down,2025-06-03 00:43:24,277,0.2023,0.10119333333333333
"Trump tariffs are hurting US and Global Economy, OECD warns",2025-06-03 07:47:00,1124,-0.4767,0.10256666666666667
How will ADBE survive AI?,2025-06-03 09:17:07,18,0.0,0.09572
Broadcom Introduces Latest Networking Chip to Accelerate Artificial Intelligence,2025-06-03 09:26:51,14,0.4767,0.06163333333333334
My company gives us a 10 year anniversary gift of either 10 company shares or a gift.,2025-06-03 09:59:21,155,0.7906,0.06286
Is it too late to buy CoreWeave CRWV?,2025-06-03 10:32:13,57,0.0,0.020399999999999998
Would you Invest in CoreWeave Long Term or place Puts on the Stock?,2025-06-03 10:52:19,21,0.0,-0.008960000000000001
What is going on with SFM?,2025-06-03 11:36:30,12,0.0,-0.008960000000000001
Anyone fighting the trend still?,2025-06-03 12:28:42,151,-0.3612,-0.002713333333333334
$IONQ Stock Future,2025-06-03 12:34:10,15,0.0,0.029066666666666668
How fucked is the USA with a debt to GDP ratio that's over 100%?,2025-06-03 13:23:15,779,-0.7845,0.06310666666666667
News for the Rolls Royce Investors :),2025-06-03 13:43:21,17,0.4588,0.07917333333333333
Is it too late to get into NUKZ(nuclear etf)?,2025-06-03 15:18:39,24,0.0,0.046200000000000005
CrowdStrike drops 6.7% on weak Q2 forecast amid soft tech spending,2025-06-03 16:57:16,114,-0.4404,0.08123999999999999
"Trump hikes steel and aluminum tariffs to 50%, spares UK",2025-06-03 17:32:38,1015,0.0,0.05313999999999999
Why I sold 75% of my HOOD shares today (despite the all-time closing high),2025-06-03 18:18:46,132,0.296,0.039653333333333325
"Thinking about picking up some Google, Apple, Broadcom and NVIDIA stock. Thoughts?",2025-06-03 19:34:44,36,0.0,0.06373333333333334
"Nvidia Surges Past Microsoft, US Markets Climb on Strong Economic Data",2025-06-03 19:35:40,128,0.5106,0.06373333333333334
Congratulate me like I'm 5!,2025-06-03 21:47:08,762,0.7177,0.07887333333333334
Toyota Industries' shares nosedive on $33 billion buyout deal,2025-06-03 23:10:02,279,0.296,0.07476
"Nvidia regains ""most valuable company"" title for the first time since January",2025-06-04 00:19:22,72,0.5256,0.07476
CrowdStrike shares drop on weak revenue guidance,2025-06-04 00:22:28,26,-0.4215,0.10411999999999999
Trump says ‘extremely hard’ to make a deal with China’s President Xi Jinping as trade talks stall,2025-06-04 02:49:13,2168,-0.2023,0.047839999999999994
"I’m about to give in and close all my shorts. As soon as I do, I’ll let you know so you can load up on puts.",2025-06-04 04:33:02,127,0.0,0.0013133333333333367
My Analysis on Target TGT ($95.78),2025-06-04 09:31:23,22,0.0,-0.04769333333333333
Trump officials delayed farm trade report over deficit forecast,2025-06-04 09:43:24,961,-0.5574,-0.08173333333333334
Trump calls Powell “unbelievable!!!” And renews call for lower interest rates,2025-06-04 09:46:29,419,0.3971,-0.12958
First half of 2021,2025-06-04 10:22:04,54,0.0,-0.17198
What’s your opinion on the Q3 (and Q4),2025-06-04 11:03:13,15,0.0,-0.17190666666666665
Tesla: A fatal self-driving crash shows the stupidity of camera-only FSD,2025-06-04 11:05:25,6238,-0.8442,-0.14208666666666667
"Are we facing a stock market crash in July? Trump's ""Section 899""",2025-06-04 12:58:02,744,-0.4019,-0.14681333333333332
Markets Ignoring Bad Data,2025-06-04 13:36:33,184,-0.7351,-0.16502666666666668
"Reddit sues AI startup Anthropic for breach of contract, ‘unfair competition’",2025-06-04 13:47:22,235,0.0,-0.16502666666666668
BULL - Webull,2025-06-04 15:38:27,37,0.0,-0.16534666666666667
Dollar Tree Falls 10% on Tariff-Driven Earnings Warning Despite Higher-Income Shopper Surge,2025-06-04 16:59:23,121,-0.34,-0.16372
What Are Your Top 10 Stocks for the Next 10 Years (Growth + Compounders)? Starting with $50K Lump Sum + Monthly DCA,2025-06-04 17:38:37,70,0.5267,-0.19051333333333334
"At this point, does it even matter what happens with the tariffs?",2025-06-04 17:49:35,417,0.0258,-0.17555333333333334
"Citi plans to slash 3,500 tech roles",2025-06-05 02:01:59,162,-0.2732,-0.11927333333333334
What would happen if Trump decided to drop all tariffs tomorrow?,2025-06-05 02:05:30,125,-0.2732,-0.09247999999999999
Initial jobless claims rise more than expected in past week,2025-06-05 08:54:18,162,0.0,-0.04347333333333334
Tesla stock falls again as Musk's 'KILL the BILL' screed hits Trump tax bill's progress,2025-06-05 09:01:00,1293,-0.5622,-0.04347333333333334
Archer Aviation Keeps Making Progress as the Market Looks the Other Way,2025-06-05 09:20:12,17,0.4215,-0.04347333333333334
US goods trade deficit narrows sharply in April as imports plunge,2025-06-05 09:22:42,138,-0.4019,-0.020806666666666675
"CBO: Trump's $2.4T Tax Cut Bill Might Be ""Paid For"" by…Tariffs?! (Yes, Really)",2025-06-05 09:27:02,751,0.2244,-0.07413333333333334
Is NVIDIA Getting Too Hot? My Short-Term Concerns with NVDA ($141.92),2025-06-05 09:30:57,19,0.0,-0.03589333333333333
What’s a stock you are long on that never gets discussed here?,2025-06-05 09:56:25,70,0.0,0.0020533333333333367
Trump and Xi held a call today - initiated by Trump,2025-06-05 10:11:05,2272,0.0,0.02026666666666667
Stablecoin company Circle goes Public,2025-06-05 10:41:46,32,0.0,0.0020533333333333367
"TACO announces ""trade deal"" with China",2025-06-05 11:06:31,1977,0.0,-0.008926666666666661
Trump and German Chancellor Merz meeting now,2025-06-05 11:47:47,40,0.0,-0.03702666666666666
‘Destroy the Ring’: Trump’s Palantir deal alarms Hill Republicans,2025-06-05 13:01:24,889,-0.2732,-0.04892
Magnificent Seven power ahead as earnings outpace rest of S&P 500 by nearly 3-to-1,2025-06-05 13:19:03,52,0.5994,-0.06387999999999999
Tesla shares sink 8% as Musk-Trump spat over budget bill boils over,2025-06-05 13:19:22,1318,0.296,-0.07241333333333332
Marketers Move Millions in Ad Spend from The Trade Desk ($TTD) to Amazon’s Ad Platform,2025-06-05 13:47:02,12,0.0,-0.07241333333333332
Carney and Trump are holding direct talks to drop tariffs: sources,2025-06-05 14:21:57,234,-0.2732,-0.07241333333333332
"Trump threatens to cut Musk’s government contracts, escalating their public feud",2025-06-05 14:58:21,9724,-0.7269,-0.10989333333333334
"Lululemon shares tumble 20% as it cuts full-year guidance, citing ‘dynamic macroenvironment’",2025-06-05 16:39:24,263,0.0,-0.0794
What are the losers you keep holding and think they would come back? and why?,2025-06-05 16:58:01,79,-0.5803,-0.0794
A stock to keep buying for life,2025-06-05 22:28:41,290,0.0,-0.06118666666666668
Amazon cuts jobs in its books division,2025-06-05 23:51:15,52,-0.128,-0.12381333333333334
How long do you think it will take $coke to recover back up to all time highs?,2025-06-06 00:40:29,49,0.0,-0.15039333333333332
"r/Stocks Daily Discussion & Fundamentals Friday Jun 06, 2025",2025-06-06 05:30:32,14,0.0,-0.15039333333333332
"US MAY NONFARM PAYROLLS RISE 139,000, UNEMPLOYMENT 4.2%",2025-06-06 08:37:20,776,-0.5622,-0.13218
"(06/6) Trump, TSLA, IPOs, and Rockets! Interesting Stocks Today.",2025-06-06 09:13:43,57,0.4574,-0.027986666666666677
WWDC 2025 is next week  Can Apple finally deliver something real in AI?,2025-06-06 09:16:03,34,0.0,-0.027986666666666677
My Analysis of Lululemon LULU ($330.78),2025-06-06 09:23:59,42,0.0,0.03615333333333332
Musk Blinks First in $34B Tesla Meltdown Amid Trump Feud  What’s Next for $TSLA?,2025-06-06 10:35:09,1278,-0.34,0.03615333333333332
Trump Calls for Full-Point Rate Cut  But May Jobs Report Just Crushed That Hope. What Now for Stocks?,2025-06-06 11:03:02,478,-0.1027,0.0030266666666666515
Jobs report & Trump’s tweets!,2025-06-06 11:07:19,82,0.0,-0.02376666666666668
Swiss Government hits UBS with $26 billion added capital requirement,2025-06-06 12:59:27,135,0.0,-0.02376666666666668
Adding some food and  beverage stocks to my energy and  tech heavy portfolio.  What are some great values out there to jump into?,2025-06-06 15:16:57,20,0.836,0.05617333333333332
China Trade Deal Next Monday - Could This Be a Game Changer for the Market?,2025-06-06 15:34:24,99,0.0,0.025679999999999988
President Donald J. Trump signed an Executive Order to ensure continued American leadership and export of unmanned aircraft systems,2025-06-06 16:57:38,209,0.3818,0.025679999999999988
"Tesla's Optimus humanoid robot program head exiting firm, Bloomberg News reports",2025-06-06 17:19:19,601,0.0,0.06183333333333332
This is a disaster of epic proportion”  Trump vs. Musk turns into a $150B Tesla bloodbath,2025-06-06 19:18:49,4918,-0.6249,0.07429333333333332
My inability to follow my intuition has cost me hundreds of thousands of dollars,2025-06-06 20:22:31,303,-0.4019,0.11049999999999999
Thoughts on $OSCR,2025-06-06 21:24:14,15,0.0,0.07645999999999999
To stock market veteran. What was the best decision you ever made in your investment career?,2025-06-06 23:29:05,126,0.6369,0.07645999999999999
"/r/Stocks Weekend Discussion Saturday - Jun 07, 2025",2025-06-07 05:30:39,12,0.0,0.013879999999999981
"How do we feel about snack and food companies right now (HSY, HRL)?",2025-06-07 09:44:27,18,0.0,0.03933333333333331
"Federal Reserve lifts $1.95 Trillion asset cap on Wells Fargo, after seven years",2025-06-07 11:01:49,925,0.5423,-0.012913333333333351
"BRZE just nuked 18%, is this a discount or am I catching a falling knife?",2025-06-07 16:13:06,129,-0.1531,-0.012913333333333351
How do you guys spot good picks?,2025-06-07 17:22:46,69,0.4404,0.02874666666666665
"Earnings up, yields up   is Trump’s $3T bill a bull trap in disguise?",2025-06-07 17:40:08,906,-0.5106,0.055539999999999985
"What To Expect in Markets This Week: June 9-13, 2025",2025-06-08 07:04:15,157,0.0,0.055539999999999985
Meta reportedly in talks to invest over $10B in Scale AI — long-term strategy or another costly pivot?,2025-06-08 10:33:00,92,-0.1027,0.01307999999999998
Looking for Quality Growth Stocks Trading at a Discount – What’s on Your Radar?,2025-06-08 13:29:02,52,0.3818,0.01307999999999998
DocuSign $DOCU ($75.28) -19% Sudden Crash and the IAM Story (IAM Analysis),2025-06-08 16:38:57,203,-0.4019,0.01307999999999998
LONG $CROX -,2025-06-08 18:48:37,57,0.0,-0.031606666666666686
National Economic Council Director said he is “very comfortable” with a trade deal closing between the US and China by Monday.,2025-06-08 21:27:57,356,0.0,-0.02140000000000002
WDDC 2025- Apple,2025-06-09 01:46:06,57,0.0,-0.05076000000000002
China wants Slimmer Pigs,2025-06-09 04:30:16,59,0.0,0.015059999999999985
"r/Stocks Daily Discussion Monday - Jun 09, 2025",2025-06-09 05:30:25,14,0.0,0.015059999999999985
"Tesla Falls as Baird Downgrades on Robotaxi, Musk-Trump Spat",2025-06-09 06:51:01,519,0.0,0.02190666666666665
What is up with Dow?,2025-06-09 09:56:02,22,0.0,-0.0035466666666666793
Robinhood shares drop after the online brokerage fails to get the nod to join the S&P 500,2025-06-09 10:13:45,230,-0.128,0.04869999999999998
Warner Bros. Discovery to split into two public companies by next year,2025-06-09 10:14:50,73,0.0,0.016919999999999984
China loosens restrictions on rare earth export licenses to the U.S. and E.U.,2025-06-09 12:28:06,335,0.0,0.016919999999999984
"A biomed company I follow (Avidity) released favorable data today, so why is it down 8%?",2025-06-09 14:39:03,17,0.4767,0.016919999999999984
Is TSLA finally going down?,2025-06-09 14:48:34,275,0.0,0.016919999999999984
Intuitive Surgical $ISRG ($526.98) Downgraded by Deutsche Bank. My Take,2025-06-09 14:56:13,17,0.0,0.016919999999999984
When will the fashion market rebound? ($LVMH question),2025-06-09 15:14:04,26,0.0,0.016919999999999984
"If the silver price increases by 10%, EMX Royalty benefits in the following ways",2025-06-09 15:20:55,13,0.3818,0.006713333333333316
The market was disappointed in Apples WWDC developer event,2025-06-09 15:34:47,178,-0.4767,0.050359999999999974
Apple is a sell for me.,2025-06-09 15:51:59,830,0.0,0.050359999999999974
Companies with investment portfolios of other public companies?,2025-06-09 17:27:18,11,0.0,0.0808533333333333
Meta Set to Throw Billions at Startup That Leads AI Data Market,2025-06-09 18:26:23,98,0.0,0.0490733333333333
Warner Bros. Discovery to Split Into Two Companies,2025-06-09 19:12:40,25,0.0,0.03886666666666663
Is Intel a new Nokia?,2025-06-09 21:56:16,46,0.0,0.0769933333333333
"Zuckerberg, Frustrated by Meta’s “Slow” AI Progress, Personally Hiring New “Superintelligence” AI Team",2025-06-10 03:05:15,951,-0.1531,0.05153999999999998
Rolls-Royce named winning bidder for UK small nuclear reactors,2025-06-10 05:16:36,240,0.5267,0.05418666666666664
"r/Stocks Daily Discussion & Technicals Tuesday - Jun 10, 2025",2025-06-10 05:30:32,16,0.0,0.08596666666666665
(06/10) IPO Movers and Rockets! Interesting Stocks Today,2025-06-10 09:18:31,23,0.4574,0.08596666666666665
Could OpenAI use Google Cloud? What does this mean for GOOG stocks?,2025-06-10 10:36:14,162,0.0,0.08596666666666665
IonQ’s Oxford Ionics Acquisition: The Quantum Leap No One’s Talking About (But Should Be),2025-06-10 11:15:20,22,-0.1531,0.11141999999999998
Bessent Emerges as Possible Contender to Succeed Fed’s Powell,2025-06-10 13:25:46,942,0.5719,0.11141999999999998
Do you think 10yr and 30yr bond auctions will have low demand?,2025-06-10 16:01:55,41,-0.3818,0.08462666666666664
Taiwan Semiconductor’s May sales jump 39.6% as AI demand stays strong,2025-06-10 17:15:17,119,0.4215,0.1066933333333333
What are your thoughts on on Louis Vuitton Moet Hennessy (LVUMY),2025-06-10 17:39:09,16,0.0,0.020133333333333305
GM to invest $4 billion in its U.S. manufacturing plants,2025-06-10 17:43:51,120,0.0,0.020133333333333305
U.S. stocks close Dow at new 3-month high Tesla surges more than 5% as VIX continues to fall,2025-06-10 19:41:23,153,0.0,-0.058446666666666695
Lutnick says US-China trade framework should resolve rare earth issue,2025-06-10 20:00:44,153,0.3818,-0.026666666666666696
"Trump tariffs may remain in effect while appeals proceed, U.S. Appeals court decides",2025-06-10 20:32:45,279,0.0,-0.01646000000000003
Treasury just did their largest buyback in history ($10B) 8 days before a massive auction and potentially a bad CPI report?,2025-06-11 00:38:12,238,-0.4019,-0.05458666666666669
Google offers buyouts to employees across the company. This trend has started in China and will extend to the western hemisphere,2025-06-11 00:44:34,1184,0.1779,-0.029133333333333362
"Tesla: The First Robotaxi Video Shows a Dangerous, Illegal Turn",2025-06-11 04:44:11,553,-0.7717,-0.048700000000000035
"r/Stocks Daily Discussion Wednesday - Jun 11, 2025",2025-06-11 05:30:29,23,0.0,-0.036840000000000026
Forget NFP the Gov is Openly LYING about The Stats,2025-06-11 07:09:20,74,-0.7213,-0.036840000000000026
"Trump Says Deal With China Done, Subject to His, Xi’s Approval",2025-06-11 08:13:26,811,0.4767,-0.036840000000000026
"CPI rose 2.4% for the 12 months ending May, Less than the expected 2.5%",2025-06-11 08:31:46,389,0.0,-0.06229333333333335
CPI for all items rises 0.1% in May; shelter up,2025-06-11 08:33:51,142,0.0,-0.047206666666666695
Trump says China will supply rare earths in ‘done’ deal,2025-06-11 08:34:18,131,0.0,0.03661999999999998
"Just saw that Tradr ETFs launched a new leveraged ETF for Archer Aviation  called ARCX, and it gives you 2x daily exposure to the stock",2025-06-11 09:30:50,14,0.128,0.039846666666666634
The bull case for stocks is growing among Wall Street strategists,2025-06-11 10:53:20,34,0.1779,0.09129333333333331
"U.S. tariffs on China won’t change again, Lutnick says",2025-06-11 11:30:11,651,0.0,0.09129333333333331
30yr Treasury's causing the market to drill tomorrow.,2025-06-11 11:51:30,280,0.0,0.13937999999999998
Carney and Trump ‘negotiating’ towards possible ‘positive’ deal: U.S. envoy,2025-06-11 13:25:16,151,0.0,0.10759999999999997
