title,timestamp,score,sentiment_score,smoothed_sentiment
"President Trump calls for the Federal Reserve to cut interest rates by ""one full point.""",2025-06-11 13:56:22,2158,0.2263,0.10759999999999997
10-Year Treasury Auction Was Strong Again in Positive Sign for U.S. Assets,2025-06-11 14:14:50,64,0.8555,0.10759999999999997
Gundlach Says ‘Reckoning Is Coming’ for US Treasuries,2025-06-11 15:11:38,70,0.2263,0.13937999999999998
TACO Trade Overextended? Trump sets tariffs at 55% with China,2025-06-11 15:13:41,478,0.0,0.13256666666666664
Oklo Surges 30% on ‘Mission-Critical’ Air Force Contract,2025-06-11 16:03:30,18,0.0,0.12070666666666664
ORCL - First Quarter Results Highlights,2025-06-11 16:08:32,11,0.0,0.09391333333333331
Apple still burning $1B year on TV+ and Cook says it not abo ut hardware?,2025-06-11 16:16:08,169,0.0,0.1310733333333333
Bessent floats extending tariff pause for countries in ‘good faith’ trade talks,2025-06-11 16:22:04,178,0.0,0.1310733333333333
GameStop Announces Proposed Private Offering of $1.75 Billion of Convertible Senior Notes,2025-06-11 17:04:21,480,0.0,0.11598666666666665
IONQ CEO just sold every single one of his shares today. 103Million dollars worth.,2025-06-11 17:09:13,528,0.4767,0.05895333333333331
Palantir & Lockheed Martin backed Voyage Technology ($VOYG),2025-06-11 19:05:43,19,0.0258,0.06359999999999998
Why are people so against individual equities?,2025-06-11 19:53:23,34,0.0,0.06359999999999998
Oil prices rise more than 4% on escalating U.S.-Iran tensions,2025-06-11 20:52:51,116,-0.4019,0.06359999999999998
"Chime prices IPO at $27 per share, valuing fintech company at $11.6 billion",2025-06-11 20:57:58,73,0.5574,0.08767999999999998
is US China Deal actually win-win?,2025-06-11 23:15:25,1374,0.0,0.10741333333333332
China’s racing to build its AI chip ecosystem as U.S. curbs bite. Here’s how its supply chain stacks up,2025-06-12 02:14:46,24,0.0,0.10741333333333332
"r/Stocks Daily Discussion & Options Trading Thursday - Jun 12, 2025",2025-06-12 05:30:45,30,0.0,0.15346666666666664
Boeing shares fall 8% after Air India plane crashes,2025-06-12 06:55:28,3067,0.296,0.12168666666666664
What do you think about Chime's IPO today?  Is there a long-term investment thesis?,2025-06-12 08:24:57,15,0.0,0.11996666666666662
(06/12) Interesting Stocks Today- BA Airplane Crash and Offerings,2025-06-12 09:14:56,13,0.0,0.1114333333333333
ACHR just popped 7.4% today… and it still feels like we’re early,2025-06-12 09:29:31,76,0.3612,0.1184933333333333
"Meta Platforms has hired Jack Rae, a researcher at Google's DeepMind AI unit, to join its new ""superintelligence"" division.",2025-06-12 10:13:32,62,0.296,0.0813333333333333
Tesla Robotaxi Launch Prediction: It's not happening,2025-06-12 12:05:07,807,0.0,0.049553333333333296
"Oracle shares pop 15% to record high on earnings beat, cloud optimism",2025-06-12 12:52:02,34,0.6908,0.029819999999999965
$AMD. Now 40% more tokens per dollar than Blackwell.,2025-06-12 13:43:36,345,0.0,0.029819999999999965
What do you think will happen on 7th of July?,2025-06-12 13:57:53,50,0.0,0.010086666666666633
Macquarie Powell would be cutting rates if not for tariffs.,2025-06-12 14:11:09,141,-0.128,0.010086666666666633
"Nvidia will stop including China in its forecasts amid US chip export controls, CEO says",2025-06-12 17:37:04,322,-0.296,0.03944666666666663
Investing in Escapism?,2025-06-12 21:12:57,46,0.0,0.015366666666666633
Dow futures fall 600 points after Israel launches attack on Iran,2025-06-12 22:29:43,4410,-0.4767,0.0249933333333333
No One’s Talking About What This Means for Archer,2025-06-13 03:16:48,68,-0.296,0.0490733333333333
"r/Stocks Daily Discussion & Fundamentals Friday Jun 13, 2025",2025-06-13 05:30:42,17,0.0,0.029813333333333303
Barclays: History suggests S&P 500 could mark turning point,2025-06-13 07:35:58,197,0.0,0.0638533333333333
What do you do to get information fastest?,2025-06-13 10:00:10,17,0.0,0.0638533333333333
US Consumer Sentiment Jumps as Inflation Expectations Improve,2025-06-13 10:03:11,87,0.4404,0.07238666666666664
"Swedish pension fund blacklists Tesla, divests stake",2025-06-13 10:54:46,1953,0.0,0.09211999999999998
Do you ever sell for a small profit?,2025-06-13 12:09:13,48,0.4404,0.11957333333333331
US to Ease Rules Hindering Tesla’s Self-Driving Cybercab,2025-06-13 13:32:16,75,0.3612,0.17108666666666666
Trump approves U.S. Steel merger with Japan’s Nippon,2025-06-13 20:08:23,1076,0.4019,0.16402666666666663
"Visa drops 7%, Mastercard 6% after report says Amazon and Walmart may bypass credit cards with stablecoins",2025-06-13 23:37:30,4163,0.5106,0.16402666666666663
"Boeing resumes China deliveries with 787-9 jet to Juneyao Airlines, Yicai reports",2025-06-14 01:22:43,83,0.0,0.16402666666666663
Palantir and Voyager,2025-06-14 05:24:34,36,0.0,0.16402666666666663
"/r/Stocks Weekend Discussion Saturday - Jun 14, 2025",2025-06-14 05:30:36,16,0.0,0.13466666666666663
To those that mostly passively invest but set aside play money at a smaller percentage,2025-06-14 14:14:22,52,0.4118,0.12782
IONQ CEO sold 2.6M shares for more than 100 million USD,2025-06-14 16:50:25,512,0.296,0.09845999999999998
India orders inspection of Boeing 787s after Air India crash,2025-06-14 18:06:35,1087,-0.4019,0.07437999999999997
Thought on Pop Mart (9922.HK),2025-06-15 05:55:47,15,0.0,0.022133333333333307
"What To Expect in Markets This Week: June 16–20, 2025",2025-06-15 08:53:41,159,0.0,-0.011906666666666696
Simple swing strategy,2025-06-15 15:30:46,42,0.0,0.02424666666666664
Is it too late to jump into AI stocks?,2025-06-15 22:37:52,205,0.0,0.02424666666666664
Oil prices jump more than 3% as Israel strikes Iran energy facilities,2025-06-16 00:29:33,715,-0.1027,0.051039999999999974
BRKB V SP500,2025-06-16 00:52:52,12,0.0,0.023586666666666638
"Archer Announces Third “Launch Edition” Partner, Striking Deal To Deploy Midnight Aircraft In Indonesia",2025-06-16 04:06:21,12,0.0,0.003853333333333305
Trump threatens to set unilateral tariff rates within 2 weeks,2025-06-16 04:12:33,1658,-0.3818,0.030646666666666638
"r/Stocks Daily Discussion Monday - Jun 16, 2025",2025-06-16 05:30:32,19,0.0,0.07060666666666664
"EU prepared to accept flat 10% US tariff with conditions, Handelsblatt reports",2025-06-16 07:41:21,849,0.5423,0.07060666666666664
"U.S. households to keep buying stocks this year, Goldman Sachs says",2025-06-16 08:06:56,203,0.0,0.07060666666666664
(06/16) Interesting Stocks Today,2025-06-16 09:13:21,11,0.4019,0.11530666666666664
"WhatsApp to Show Ads, Offer Paid Subscriptions for First Time",2025-06-16 09:14:18,101,0.0,0.12215333333333331
Cathie Wood Just Bought Millions in Archer Aviation,2025-06-16 10:12:04,278,0.0,0.14274666666666663
Trump Says Trade Deal With Canada ‘Achievable’ as G-7 Opens,2025-06-16 12:23:27,240,0.0,0.1172933333333333
Thank you for the small gains. The advice here has been priceless.,2025-06-16 15:09:46,51,0.5994,0.14274666666666663
Real Estate or Stocks?,2025-06-16 16:18:58,14,0.0,0.10108666666666663
AMD Soars 10% as Piper Sandler Raises Price Target After 'Advancing AI' Event,2025-06-16 16:48:40,347,0.0,0.1048933333333333
US and UK say they’ve cemented a trade agreement that Trump calls fair for both nations,2025-06-16 17:43:50,498,0.6705,0.1048933333333333
How does one do proper research on a company?,2025-06-16 18:20:59,14,0.0,0.10489333333333331
Why US Stocks Aren’t Bracing for a Bigger Sell-off Despite Israel-Iran Tensions?,2025-06-16 18:32:35,347,0.3089,0.14096666666666663
Senate committee's changes to tax bill slam US solar stocks,2025-06-16 20:54:01,154,-0.3818,0.14096666666666663
"r/Stocks Daily Discussion & Technicals Tuesday - Jun 17, 2025",2025-06-17 05:30:20,16,0.0,0.14096666666666663
Eutelsat’s newly appointed CEO firmly denied that the satellite operator was in financial difficulties.,2025-06-17 06:49:43,33,-0.6249,0.12779999999999997
PureCycle announces huge capital raise and global growth plans for their plastic recycling plants,2025-06-17 08:42:03,16,0.5994,0.12779999999999997
Reddit Launches AI-Driven Tools for Advertisers,2025-06-17 09:09:27,17,0.0,
"Sunrun -35%, SolarEdge -30%, First Solar -16% as Senate Bill Cuts Green Incentives, EV Credit Ends Early",2025-06-17 09:20:20,460,0.4019,
TSMC spends $193 million on U.S. corporate bonds! Strengthening Fixed Income Layout,2025-06-17 09:28:15,56,0.5411,
Oracle says xAI models are now available on Oracle Cloud Infrastructure,2025-06-17 09:31:48,13,0.0,
How Trump's G7 Trade Stance Will Affect U.S. Stocks,2025-06-17 14:37:03,231,0.0,
"Meta to release smart glasses with Oakley and Prada, extending Luxottica partnership",2025-06-17 15:07:40,100,0.4019,
Microsoft & AMD team up on next gen Xbox chips  what does this mean for Nvidia and Sony?,2025-06-17 18:27:24,72,0.0,
